{
  "$schema": "https://json-schema.org/draft/2020-12/schema",
  "$id": "urn:research-loom:core:capability-invocation:0.1.0",
  "title": "research-loom canonical Capability Invocation",
  "description": "Invocation envelope binding one declared function to one bounded Context Pack, immutable research/configuration pins, and opaque runtime authorization evidence.",
  "type": "object",
  "additionalProperties": false,
  "required": [
    "schema_version",
    "invocation_id",
    "run_id",
    "project_id",
    "capability",
    "execution_mode",
    "context_pack",
    "pins",
    "runtime_authorization_evidence",
    "trace",
    "invocation_digest"
  ],
  "properties": {
    "schema_version": {
      "const": "0.1.0"
    },
    "invocation_id": {
      "$ref": "#/$defs/identifier"
    },
    "run_id": {
      "$ref": "#/$defs/identifier"
    },
    "project_id": {
      "$ref": "#/$defs/identifier"
    },
    "capability": {
      "$ref": "#/$defs/capability_binding"
    },
    "execution_mode": {
      "$ref": "#/$defs/execution_mode"
    },
    "context_pack": {
      "$ref": "#/$defs/context_pack_ref"
    },
    "pins": {
      "$ref": "#/$defs/pins"
    },
    "runtime_authorization_evidence": {
      "$ref": "#/$defs/runtime_authorization"
    },
    "trace": {
      "$ref": "#/$defs/trace"
    },
    "invocation_digest": {
      "$ref": "#/$defs/digest"
    }
  },
  "$defs": {
    "identifier": {
      "type": "string",
      "pattern": "^[A-Za-z0-9][A-Za-z0-9._-]{0,127}$"
    },
    "capability_id": {
      "type": "string",
      "pattern": "^[a-z0-9][a-z0-9._-]{0,127}$"
    },
    "function_id": {
      "type": "string",
      "pattern": "^[a-z0-9][a-z0-9._-]{0,127}$"
    },
    "semver": {
      "type": "string",
      "pattern": "^(0|[1-9][0-9]*)\\.(0|[1-9][0-9]*)\\.(0|[1-9][0-9]*)$"
    },
    "digest": {
      "type": "string",
      "pattern": "^sha256:[0-9a-f]{64}$"
    },
    "execution_mode": {
      "enum": [
        "real",
        "virtual",
        "synthetic_test"
      ]
    },
    "profile_pin": {
      "type": "object",
      "additionalProperties": false,
      "required": [
        "profile_id",
        "profile_type",
        "profile_version",
        "manifest_sha256"
      ],
      "properties": {
        "profile_id": {
          "type": "string",
          "pattern": "^[a-z0-9][a-z0-9._-]{0,127}$"
        },
        "profile_type": {
          "enum": [
            "research",
            "organization",
            "narrative",
            "publication"
          ]
        },
        "profile_version": {
          "$ref": "#/$defs/semver"
        },
        "manifest_sha256": {
          "type": "string",
          "pattern": "^[0-9a-f]{64}$"
        }
      }
    },
    "research_snapshot_pin": {
      "type": "object",
      "additionalProperties": false,
      "required": [
        "snapshot_id",
        "revision",
        "content_digest"
      ],
      "properties": {
        "snapshot_id": {
          "$ref": "#/$defs/identifier"
        },
        "revision": {
          "type": "integer",
          "minimum": 0
        },
        "content_digest": {
          "$ref": "#/$defs/digest"
        }
      }
    },
    "pins": {
      "type": "object",
      "additionalProperties": false,
      "required": [
        "project_config",
        "effective_profile_set",
        "research_snapshot"
      ],
      "properties": {
        "project_config": {
          "type": "object",
          "additionalProperties": false,
          "required": [
            "configuration_digest"
          ],
          "properties": {
            "configuration_digest": {
              "$ref": "#/$defs/digest"
            }
          }
        },
        "effective_profile_set": {
          "type": "object",
          "additionalProperties": false,
          "required": [
            "schema_version",
            "content_digest",
            "core_contracts",
            "profile_pins"
          ],
          "properties": {
            "schema_version": {
              "const": "0.1.0"
            },
            "core_contracts": {
              "type": "object",
              "additionalProperties": false,
              "required": [
                "research_contract",
                "invariant_contract"
              ],
              "properties": {
                "research_contract": {
                  "$ref": "#/$defs/semver"
                },
                "invariant_contract": {
                  "$ref": "#/$defs/semver"
                }
              }
            },
            "profile_pins": {
              "type": "array",
              "minItems": 1,
              "items": {
                "$ref": "#/$defs/profile_pin"
              }
            },
            "content_digest": {
              "$ref": "#/$defs/digest"
            }
          }
        },
        "research_snapshot": {
          "$ref": "#/$defs/research_snapshot_pin"
        }
      }
    },
    "capability_binding": {
      "type": "object",
      "additionalProperties": false,
      "required": [
        "capability_id",
        "capability_version",
        "descriptor_digest",
        "function_id"
      ],
      "properties": {
        "capability_id": {
          "$ref": "#/$defs/capability_id"
        },
        "capability_version": {
          "$ref": "#/$defs/semver"
        },
        "descriptor_digest": {
          "$ref": "#/$defs/digest"
        },
        "function_id": {
          "$ref": "#/$defs/function_id"
        }
      }
    },
    "context_pack_ref": {
      "type": "object",
      "additionalProperties": false,
      "required": [
        "context_pack_id",
        "context_pack_digest"
      ],
      "properties": {
        "context_pack_id": {
          "$ref": "#/$defs/identifier"
        },
        "context_pack_digest": {
          "$ref": "#/$defs/digest"
        }
      }
    },
    "runtime_authorization": {
      "type": "object",
      "additionalProperties": false,
      "required": [
        "authorization_id",
        "authorization_digest",
        "capability_id",
        "function_id",
        "execution_modes",
        "resource_reference_ids"
      ],
      "properties": {
        "authorization_id": {
          "$ref": "#/$defs/identifier"
        },
        "authorization_digest": {
          "$ref": "#/$defs/digest"
        },
        "capability_id": {
          "$ref": "#/$defs/capability_id"
        },
        "function_id": {
          "$ref": "#/$defs/function_id"
        },
        "execution_modes": {
          "type": "array",
          "minItems": 1,
          "uniqueItems": true,
          "items": {
            "$ref": "#/$defs/execution_mode"
          }
        },
        "resource_reference_ids": {
          "type": "array",
          "uniqueItems": true,
          "items": {
            "$ref": "#/$defs/identifier"
          }
        }
      },
      "description": "Opaque evidence of an authorization decision made outside this contract. No bearer token or permission-engine format is standardized here."
    },
    "trace": {
      "type": "object",
      "additionalProperties": false,
      "required": [
        "trace_id"
      ],
      "properties": {
        "trace_id": {
          "$ref": "#/$defs/identifier"
        },
        "parent_run_id": {
          "$ref": "#/$defs/identifier"
        }
      }
    }
  }
}
