{"schema_version":"0.1.0","invocation_id":"INV-001","run_id":"RUN-001","project_id":"PRJ-1","capability":{"capability_id":"fixture.research-support","capability_version":"1.0.0","descriptor_digest":"sha256:7c490b81baad229a38ce3f1588721ccc496f37733fd082f86c278c387f445487","function_id":"investigate"},"execution_mode":"virtual","context_pack":{"context_pack_id":"CTX-001","context_pack_digest":"sha256:d6a91b9a6127f2ad396255ffdf95ea2d79a79a0339421c0936e36f7cba197bd8"},"pins":{"project_config":{"configuration_digest":"sha256:9fa677cbca9f50f54055021d8c1f0febfe636795a96931174f2aef6052fb13fb"},"effective_profile_set":{"schema_version":"0.1.0","core_contracts":{"research_contract":"0.1.0","invariant_contract":"0.1.0"},"profile_pins":[{"profile_id":"fixture.research-base","profile_type":"research","profile_version":"1.0.0","manifest_sha256":"6311662384e51505f779c16212fc1cd892dafeb0260c680e8a51490f0c263f34"},{"profile_id":"fixture.research-strict","profile_type":"research","profile_version":"1.1.0","manifest_sha256":"1d7bbbe2d43ac8e54da1cb1cb940dcf0be977543d97a8fb218a453969e50069d"},{"profile_id":"fixture.organization","profile_type":"organization","profile_version":"2.0.0","manifest_sha256":"888a427c2bc15acfa775af145dccc2eeeb1941d53cdb5144901a69d75d5014b5"},{"profile_id":"fixture.narrative","profile_type":"narrative","profile_version":"1.0.0","manifest_sha256":"c85bb1e8127d9145ccaf0d97df4c6a0bcbad37afeb2cd43c886889be9a7e3570"},{"profile_id":"fixture.publication","profile_type":"publication","profile_version":"1.0.0","manifest_sha256":"c47fad44c58ba2f1b53c6ee6a26724dd42e0190e58c9ab619dbdb625c1ff945e"}],"content_digest":"sha256:ab4631d96e1d81f6f8cb3fda8d62dc5fbf5c7500895001cb91f16f803d336e17"},"research_snapshot":{"snapshot_id":"SNP-1","revision":0,"content_digest":"sha256:eb0b25b360df904b109f94bf5cdb3d4a7e3d59fca40fc48a1f95ffca26657391"}},"runtime_authorization_evidence":{"authorization_id":"AUTH-001","authorization_digest":"sha256:aaaaaaaaaaaaaaaaaaaaaaaaaaaaaaaaaaaaaaaaaaaaaaaaaaaaaaaaaaaaaaaa","capability_id":"fixture.research-support","function_id":"investigate","execution_modes":["virtual"],"resource_reference_ids":["REF-INPUT-001","REF-SOURCE-001","REF-ARTIFACT-001"]},"trace":{"trace_id":"TRACE-001"},"invocation_digest":"sha256:769ba1437e8e1e29e7a972fe139d131630f4dda286af65973f07b684a3f0e768"}
